{
  "id": "EP45-A1-ARCHIVE-001",
  "domain": "archive",
  "baseline_id": "rebirth-evolution-ep45-98c7dd3a",
  "status": "extraido",
  "sources": [
    {
      "path": "data.sah",
      "sha256": "6ad31356e94e243b45d4f4a6ffe881d76dd945a0e4f7f22687ebdf6026bf7f3c"
    },
    {
      "path": "data.saf",
      "sha256": "e3c7f3a8268d5242b6199b99ca482c3390fc012fad2257dd155b1e35794d5e7b"
    }
  ],
  "method": "archive_extraction",
  "reproduction": {
    "tool": "tools/ep45-client/archive.py",
    "version": "1.0.0",
    "command": "python3 tools/ep45-client/archive.py extract --client-dir .client-ep45-cache/rebirth-evolution-ep45-98c7dd3a/originals --output-dir .client-ep45-cache/rebirth-evolution-ep45-98c7dd3a --report-dir docs/client-ep45/catalogs --baseline-id rebirth-evolution-ep45-98c7dd3a --expected-manifest docs/client-ep45/catalogs/loose-files.current.json"
  },
  "observed_at": "2026-10-01T22:02:58.032383+00:00",
  "validation": [
    "validation/phase-a0-a1.md",
    "catalogs/extraction-report.json",
    "13 passing integrity/containment/resume tests: python3 tools/ep45-client/test_archive.py",
    "Second full extraction pass revalidated existing files against frozen SAF ranges"
  ],
  "unknowns": [
    "Semantics of six file-shaped records after the SAH tree",
    "Semantics of 95141488 bytes in SAF ranges not referenced by cataloged entries",
    "Gameplay record layouts and decryption checksums are not yet validated"
  ],
  "backend_implications": [
    "Use indexed client files as future data sources, without importing EP8 definitions",
    "A0/A1 completion does not release backend implementation; A2-A7 remain pending"
  ]
}
